{
  "portal_version": "0.1",
  "name": "Static Fallback (reference)",
  "brief": "A Portal hosted as a static JSON file plus a single serverless function dispatcher. Demonstrates the pattern for sites that ship as static assets (Jekyll, Hugo, Astro) and only have one tiny serverless function for /portal/call.",
  "tools": [
    {
      "name": "whoami",
      "description": "Return a fixed self-description.",
      "params": {}
    },
    {
      "name": "posts",
      "description": "Return up to N hardcoded posts. Demonstrates a read-only tool driven by static data.",
      "params": {
        "limit": {
          "type": "number",
          "required": false,
          "description": "1-3, default 3"
        }
      }
    }
  ],
  "call_endpoint": "/api/portal-static-example/call",
  "auth": "none",
  "pricing": { "model": "free" }
}
